{
  "work_id": "backend-migration",
  "source_brief": "specs/backend-migration/brief.json",
  "summary": "Select option D: a deliberately thin standalone Deno 2 TypeScript compatibility service combined with Supabase Postgres and native RLS. The service preserves the same-origin React delivery model and the four supported /api routes, validates the existing Auth0 access token, normalizes requests and responses, and delegates durable state, relational constraints, atomic upserts, timestamps, ordering, and row isolation to Supabase. Application tables live in a non-Data-API-exposed schema and are reached through a least-privilege Postgres role whose RLS identity is set transaction-locally from the verified Auth0 sub. Node.js, Bun, direct browser Data API access, and Supabase Edge Functions are not used in the initial replacement. The migration uses an idempotent TypeScript data tool and a short write freeze rather than permanent dual writes. The Go/Heroku/MongoDB system remains recoverable through Review and Release, and production changes remain separately authorized.",
  "decisions": [
    {
      "id": "ARCH-001",
      "area": "architecture",
      "decision": "Select option D, a standalone Deno TypeScript API plus Supabase hybrid: use a Deno 2 compatibility service for the public HTTP/auth boundary and use Supabase Postgres, SQL constraints, migrations, and RLS for the data/security core. Do not use the Supabase Data API or Edge Functions in the initial user request path.",
      "rationale": "The replacement has only four supported routes, but their paths, same-origin behaviour, Auth0 access-token contract, and response shapes must remain stable. A thin service preserves that boundary without reproducing Mongo-centric Go internals. Supabase still owns the hard data guarantees. Direct Data API/Edge use would require route rewrites or a proxy, a different Auth0 token integration, and separate static hosting. The split keeps a future move to direct Supabase APIs possible after compatibility is no longer required.",
      "alternatives": [
        "A. Node.js TypeScript API + Supabase: mature ecosystem, LTS policy, and exact route compatibility, but rejected as the selected runtime because Deno can preserve the same boundary with native TypeScript execution, web-standard APIs, a lockfile, and an explicit runtime permission model. Node compatibility remains available for vetted npm dependencies (https://docs.deno.com/runtime/fundamentals/node/).",
        "B. Bun TypeScript API + Supabase: attractive startup speed, built-in TypeScript execution, and tooling, but rejected because this low-volume persistent service has no measured runtime bottleneck and Bun still documents incomplete Node API compatibility; the additional runtime variable adds migration and operations risk without user value (https://bun.sh/docs/runtime/nodejs-compat).",
        "C. Supabase-native Postgres/RLS/Data API/Edge Functions: lowest standalone compute footprint and strong caller-scoped RLS, but rejected for the initial cutover because Data API and function URLs do not preserve /api paths or current envelopes, Edge Functions use a Deno-compatible runtime and separate function URL, static SPA hosting still needs a boundary, and Auth0 third-party access requires an Auth0 role claim and ID-token flow rather than the current API access token (https://supabase.com/docs/guides/auth/third-party/auth0).",
        "D. Standalone Deno TypeScript API plus Supabase: selected because it preserves the existing public and Auth0 contracts in one small compute boundary while moving durable data rules and row isolation to Supabase. It avoids a second proxy/function layer and keeps the API deployable as a portable OCI container."
      ],
      "reversibility": "moderate"
    },
    {
      "id": "ARCH-002",
      "area": "architecture",
      "decision": "Run the compatibility service on the latest stable Deno 2 release that has passed the repository test suite, pinned in the container image and lockfile, as an OCI container. Use native web-standard APIs where practical, permit vetted JSR or npm dependencies only through the checked-in lockfile, and run with only the filesystem, network, and environment permissions required by the service. Keep deployment portable and require the eventual managed container target to support an Australian region, managed TLS/custom domain, environment secrets, health checks, structured logs, and rollback. The exact hosting vendor is not selected by this design and requires no application-architecture change.",
      "rationale": "Deno 2 is a stable TypeScript runtime with Node/npm compatibility, official container images, lockfile integrity checking, and granular runtime permissions (https://docs.deno.com/runtime/fundamentals/stability_and_releases/, https://docs.deno.com/runtime/reference/docker/, https://docs.deno.com/runtime/fundamentals/security/). Pinning the tested release and dependencies prevents an unreviewed runtime update from changing production. Container portability makes the hosting vendor moderately reversible and avoids replacing Heroku with another vendor-specific application API. Australian compute keeps database traffic near the Sydney Supabase project even though the brief strictly requires Australian residency for stored data and managed backups.",
      "alternatives": [
        "Node.js 24 LTS: lower dependency-compatibility risk and a conventional production support line, but not selected after the owner chose standalone Deno.",
        "Track Deno latest at every deploy without pinning: rejected because it weakens reproducibility and makes runtime upgrades implicit.",
        "Continue on Heroku: allowed only as the rollback source, not the target architecture.",
        "Select a hosting vendor now: deferred because the container contract isolates vendor choice and production provisioning needs separate authority."
      ],
      "reversibility": "moderate"
    },
    {
      "id": "ARCH-003",
      "area": "architecture",
      "decision": "The standalone Deno service serves the built React SPA and the four supported API routes from one origin during this migration. Production retains the existing public web origin and /api paths; local development retains separate client and API ports. Frontend hosting may be separated only in a later approved design.",
      "rationale": "This is the smallest way to preserve Auth0 callback/logout URLs, same-origin API resolution, custom-domain behaviour, and rollback. Static serving is retained for an explicit compatibility reason rather than copied automatically from Go.",
      "alternatives": [
        "Separate static host and API origin: operationally clean but requires coordinated DNS, CORS, Auth0 callback, API base URL, and rollback changes during the data migration.",
        "Supabase Storage as static hosting: rejected because Storage has no approved responsibility and is not needed for this migration."
      ],
      "reversibility": "easy"
    },
    {
      "id": "RESP-001",
      "area": "architecture",
      "decision": "Existing Go responsibility disposition: KEEP IN APPLICATION CODE — the four browser HTTP route contracts; Auth0 bearer-token verification; verified-sub extraction; optional x-user-id mismatch rejection; CORS enforcement; request orchestration; API-to-database field mapping; normalized response serialization; and initial static SPA delivery. MOVE TO SUPABASE — feelings and weekly-tracker persistence; relational schema and migrations; user-row isolation via RLS; database grants; status/mood/type constraints; the one-tracker-per-user/week guarantee; atomic weekly upsert; server timestamps; deterministic feeling ordering; indexes; generated record IDs; private Australian Storage for already-encrypted operator backup ciphertext; and operator data access through provider controls. KEEP IN OPERATOR TOOLING — PostgreSQL logical export, authenticated encryption, manifests and checksums, private Storage upload/download, restore rehearsal, migration, and reconciliation. REPLACE — Go transport/persistence structs with separate TypeScript request/response schemas and database types; Gin routing/listener with a standalone Deno TypeScript HTTP service; handwritten JWKS fetching/cache with a maintained Deno-compatible OIDC/JWT library; permissive Go decoding with strict TypeScript request schemas; Mongo client/bootstrap and startup ping/fatal boot coupling with a least-privilege Deno-compatible pooled Postgres connection plus platform readiness checks; ad-hoc errors with one structured error envelope; default Gin logging/recovery with sanitized structured logs and framework error boundaries; broad Mongo credentials and Heroku PORT configuration with scoped Mongo rollback credentials and Deno runtime/Supabase configuration; checked-in Go binary and generated server web assets with reproducible locked builds. REMOVE — chat capability and ingest routes; agent read route; chat/agent shared-token and allowlist middleware; their environment variables; the Heroku worker image declaration; unmatched /api/ping client call and unused PingComponent; all Mongo-specific query/decoding code after release; and any application Storage, queue, scheduler, worker, or Edge Function responsibility not backed by an approved requirement.",
      "rationale": "This classifies every observed Go backend responsibility by its target owner and prevents a file-for-file rewrite. Application code remains only where the compatibility or verified-identity boundary requires it; invariants and durable authorization move down to Postgres; obsolete integrations and accidental code are omitted.",
      "alternatives": [
        "Recreate handler/repository/service layers for every Go handler: rejected as unnecessary ceremony for four routes and a one-for-one rewrite risk.",